{"candidate_id":"22d79bdf89e24c5260f63668c4992937b545d0ca0f364abd074421eca1d82356","changed_files":["BAGO_AGENTIC_DATA_LAB/docs/verification/csv-chat-20261101/plan/CONTRACT.md","BAGO_AGENTIC_DATA_LAB/docs/verification/csv-chat-20261101/plan/BASELINE.json","BAGO_AGENTIC_DATA_LAB/docs/verification/csv-chat-20261101/plan/PLAN.json"],"mission_id":"CSV_CHAT_GOVERNED_20261101","next_consumers":["W02","W03","W04"],"outputs":[{"kind":"contract","path":"BAGO_AGENTIC_DATA_LAB/docs/verification/csv-chat-20261101/plan/CONTRACT.md","sha256":"86902bb2fc1a794eb18cbaff81656ed8a468c8ed41a8fd45e9db98b731a6d43b"},{"kind":"contract","path":"BAGO_AGENTIC_DATA_LAB/docs/verification/csv-chat-20261101/plan/BASELINE.json","sha256":"127e8d0f9310c335246264c164f8ebc2bcfd78562c6e7ffa49856f8ce9358e11"},{"kind":"contract","path":"BAGO_AGENTIC_DATA_LAB/docs/verification/csv-chat-20261101/plan/PLAN.json","sha256":"3d2da1a27584d12441cb51396779397229e0f24b7b7de1d9bd540b06f9384649"}],"payload_sha256":"0cf886b59a5e06fc1009704d7947140374d164eaabf2449753c16fe688330237","residual_risks":["Live provider interpretation and Windows are not baseline-verified.","Tracked legacy runtime retained; coordination uses separate parent root."],"role":"team-orchestrator","scope_sha256":"405836501143c1d45705e284201ec0a928bbaf59447a9b6ba40a6cb86f8876e8","status":"DONE","verification":[{"command":"[\"/workspace/scratch/54b1628604af/adl-venv/bin/python\",\"-c\",\"import os,sys; os.chdir(\\\"BAGO_AGENTIC_DATA_LAB\\\"); sys.path.insert(0,os.getcwd()); import pytest; sys.exit(pytest.main([\\\"-q\\\",\\\"tests/test_workspace_read.py\\\"]))\"]","evidence":".bago/team/runtime/executions/733480330539413aa2df0a69d6196b90/receipt.json","execution_id":"733480330539413aa2df0a69d6196b90","id":"baseline","result":"PASS"}],"work_id":"W01"}
