{"candidate_id":"9bdf09833dd28ab922485c21a23e0f645efb5cb812712150dd3c1b07d4f8fada","changed_files":["src/App.tsx","src/components/ProviderSettings.tsx","tests/providers/provider-settings.test.tsx","src/components/ProviderSettings.css","tests/ui/providers-footer/actual-app-brave_r2.mjs","nearest-goals-check/footer-repair/run_footer_checks_r2.py","nearest-goals-check/footer-repair/layout-r2/REPORT.md"],"findings":[],"mission_id":"BAGO_MODEL_FOOTER_COMPLETE_REPAIR_20261031","next_consumers":[],"outputs":[{"kind":"VERIFICATION_EVIDENCE","path":"nearest-goals-check/footer-repair/layout-r2/browser-attempt1/BROWSER_RESULTS.json","sha256":"d569f3e4ffbe0f67fa271ec6c46c36b6a9bbdd217f29d20cc20f054c1fad8fc2"},{"kind":"VERIFICATION_EVIDENCE","path":"nearest-goals-check/footer-repair/layout-r2/browser-attempt2/BROWSER_RESULTS.json","sha256":"db5e888389b1249f02df14eb88a6edce898f9035bff177a788ff86a02a8e38a3"},{"kind":"VERIFICATION_EVIDENCE","path":"nearest-goals-check/footer-repair/layout-r2/browser-attempt2/desktop-after-exit.html","sha256":"8578b4794d6dccf3dba4922537618dd19388e445a37879ba2262fd40b29f132e"},{"kind":"VERIFICATION_EVIDENCE","path":"nearest-goals-check/footer-repair/layout-r2/browser-attempt2/desktop-after-exit.png","sha256":"190e69975dfbe0a4ca596505d4684c08b722977e4d5360b4d3b6c613375fffcd"},{"kind":"VERIFICATION_EVIDENCE","path":"nearest-goals-check/footer-repair/layout-r2/browser-attempt2/desktop-models-after-list-scroll.png","sha256":"2a24294494948139baf098fdd6e4f6c737d0b5e73a06d914e4430529a2f2bac1"},{"kind":"VERIFICATION_EVIDENCE","path":"nearest-goals-check/footer-repair/layout-r2/browser-attempt2/desktop-models-before-exit.png","sha256":"9c78d8cd83ae2b880a60aa41012418fadaf00be7a1231bd856f01fa775938f57"},{"kind":"VERIFICATION_EVIDENCE","path":"nearest-goals-check/footer-repair/layout-r2/browser-attempt2/desktop-providers-short-scroll.png","sha256":"592f0a435c5717c3e0d73f72a3e82f0138d286da21cf63dcfae6b40720d621d4"},{"kind":"VERIFICATION_EVIDENCE","path":"nearest-goals-check/footer-repair/layout-r2/browser-attempt2/mobile-after-exit.html","sha256":"86184586ce6d3e3f36d48f29414e1d34846e7991c0b7a30b28f17d6d28e4255b"},{"kind":"VERIFICATION_EVIDENCE","path":"nearest-goals-check/footer-repair/layout-r2/browser-attempt2/mobile-after-exit.png","sha256":"b4b3c3a00c6a9fc5d3d78e296d409372dfa2999c78e2bbe9249c5ad70691721e"},{"kind":"VERIFICATION_EVIDENCE","path":"nearest-goals-check/footer-repair/layout-r2/browser-attempt2/mobile-models-after-list-scroll.png","sha256":"4d9c05ef43d1251aeffb2de5e66411e56b9709569059c48f5332fbf92e6a3329"},{"kind":"VERIFICATION_EVIDENCE","path":"nearest-goals-check/footer-repair/layout-r2/browser-attempt2/mobile-models-before-exit.png","sha256":"d0b81010c49b53e174dcc594f14068c548da1681d878d273c81cc01b0286a1cb"},{"kind":"VERIFICATION_EVIDENCE","path":"nearest-goals-check/footer-repair/layout-r2/browser-attempt2/mobile-providers-short-scroll.png","sha256":"5bef50bd3d337500cf036b4f1d142133fd0a825c49f295b26f08627510a30646"},{"kind":"VERIFICATION_EVIDENCE","path":"nearest-goals-check/footer-repair/layout-r2/build.stderr.log","sha256":"351b524197fb492920789369e7f1a271420c757633fbb553b280a181ac4c31a4"},{"kind":"VERIFICATION_EVIDENCE","path":"nearest-goals-check/footer-repair/layout-r2/build.stdout.log","sha256":"4d5706c50bf47f86e1d8d15238726a6ec2367087a0e45e90a5c393bfb3947785"},{"kind":"VERIFICATION_EVIDENCE","path":"nearest-goals-check/footer-repair/layout-r2/focused-tests.stderr.log","sha256":"e3b0c44298fc1c149afbf4c8996fb92427ae41e4649b934ca495991b7852b855"},{"kind":"VERIFICATION_EVIDENCE","path":"nearest-goals-check/footer-repair/layout-r2/focused-tests.stdout.log","sha256":"19d93be51511dc1e463354325e686a38e609ea01e28c590580f86366aea6d3e3"},{"kind":"VERIFICATION_EVIDENCE","path":"nearest-goals-check/footer-repair/layout-r2/focused-vitest.json","sha256":"0f87d47002e5a1b4ce5ef95e0204c60fd2274f1eb6a20a351c5cf54805c3b93e"},{"kind":"VERIFICATION_EVIDENCE","path":"nearest-goals-check/footer-repair/layout-r2/REPORT.md","sha256":"6adb2a40c82eff6a6a1e6c0587d0ff3b5cb628344fecf59b45dbf47ccecf5dc6"},{"kind":"VERIFICATION_EVIDENCE","path":"nearest-goals-check/footer-repair/layout-r2/TEST_RESULTS_R2.json","sha256":"69e36b9241664ed0360c8cfcbed028e0b4d30589fe78e124eaee4fba963e7f21"},{"kind":"SOURCE","path":"nearest-goals-check/footer-repair/run_footer_checks_r2.py","sha256":"058c1c3d6f53b0d680bc25d3ddc79c8790e03f3f3a4de45cb13fb782d3e91306"},{"kind":"SOURCE","path":"src/App.tsx","sha256":"1800630d38ba3f871a721bf6b5e5ff64a3e004a8b1f54ae4841f776abaf0681b"},{"kind":"SOURCE","path":"src/components/ProviderSettings.css","sha256":"101b81c65d1204d0c8da5a538b69e2a6919eeee7a36cb6dfc7b8a12ae731bc6f"},{"kind":"SOURCE","path":"src/components/ProviderSettings.tsx","sha256":"fe849e9fe9f24a09b840e4fdb5540dce098bd74698d525e9033719ec3a51f1d1"},{"kind":"SOURCE","path":"tests/providers/provider-settings.test.tsx","sha256":"ac3c8046669a9d59dd7262c696bc4ec9d73b8820874d4e90ac3970bbf17adbaa"},{"kind":"SOURCE","path":"tests/ui/providers-footer/actual-app-brave_r2.mjs","sha256":"cef22d23207440726d68936741bfdf0685e76e757d93148e0d668c0bdd1df8f6"}],"payload_sha256":"ffb9e9110647c8fff23caa2ef662f4269ef4eb40847aed25fdc180d59fbd8ada","residual_risks":["Independent review and global repository acceptance remain pending; author verification is not independent.","Full827 Vitest is preserved F01 historical evidence before CSS; F02 reran six affected tests and fresh build, not a new full827.","Actual App browser uses synthetic intercepted APIs; no provider/backend/production integration is claimed.","All F01 failures and initial F02 GPU sandbox failure are preserved; passing browser used authorized host execution with Chromium sandbox active."],"role":"decision-ui-engineer","scope_sha256":"0af844db09c04531999970ed71e0bce9ed1f51245b48416d0453a7bc7cef9df9","status":"DONE","verification":[{"command":"[\"python\",\"-B\",\"nearest-goals-check/footer-repair/run_footer_checks_r2.py\"]","evidence":".bago/team/runtime/executions/761c19aa831c4a4e9d7cce859496d629/receipt.json","execution_id":"761c19aa831c4a4e9d7cce859496d629","id":"footer-tests","result":"PASS"},{"command":"[\"node\",\"tests/ui/providers-footer/actual-app-brave_r2.mjs\",\"browser-attempt2\"]","evidence":".bago/team/runtime/executions/5aafa834b0c048b4acbf1671f002bcba/receipt.json","execution_id":"5aafa834b0c048b4acbf1671f002bcba","id":"footer-browser","result":"PASS"}],"work_id":"F02"}
