{"candidate_id":"22d79bdf89e24c5260f63668c4992937b545d0ca0f364abd074421eca1d82356","changed_files":["BAGO_AGENTIC_DATA_LAB/src/agent_tools/workspace_read.py","BAGO_AGENTIC_DATA_LAB/src/agent_tools/csv_chat.py","BAGO_AGENTIC_DATA_LAB/src/api/server.py","BAGO_AGENTIC_DATA_LAB/src/api/schemas.py","BAGO_AGENTIC_DATA_LAB/tests/test_csv_chat_access.py","BAGO_AGENTIC_DATA_LAB/docs/verification/csv-chat-20261101/backend/IMPLEMENTATION.md"],"findings":[{"affects_correction":true,"description":"Reproduced read after revocation during policy lock wait. Existing policy/STOP/grant effect leases now revalidate after waits and cover bounded IO/publication; seven regressions and six independent boundary reproductions pass.","id":"CSV-AUTH-WAIT","scope":"PRODUCT","severity":"P1","status":"CLOSED"}],"mission_id":"CSV_CHAT_GOVERNED_20261101","next_consumers":["W12"],"outputs":[{"kind":"source","path":"BAGO_AGENTIC_DATA_LAB/src/agent_tools/workspace_read.py","sha256":"acf2e35f8e3e72cf75c2eb6ee4bd7ac5ad9b4a4ce9e9483a33c49ebcb44a3e0c"},{"kind":"source","path":"BAGO_AGENTIC_DATA_LAB/src/agent_tools/csv_chat.py","sha256":"6a7f0cfd520bf6d3c71589c7e7106b2788a87f9cb78cae47157aaf7403143719"},{"kind":"source","path":"BAGO_AGENTIC_DATA_LAB/src/api/server.py","sha256":"a7949d8df192c142232ff05602d1b46a184443c02a504656c13fd4a6de33c629"},{"kind":"source","path":"BAGO_AGENTIC_DATA_LAB/src/api/schemas.py","sha256":"9f971639f7ea49e4ca892a22b6ffd543fa9226a5772440c7120712c2e4189937"},{"kind":"source","path":"BAGO_AGENTIC_DATA_LAB/tests/test_csv_chat_access.py","sha256":"a545083ef6b58bc145f7cfaf68bf4b74dbb035a713d193693c8ec2144793a302"},{"kind":"verification","path":"BAGO_AGENTIC_DATA_LAB/docs/verification/csv-chat-20261101/backend/IMPLEMENTATION.md","sha256":"7be57e44ae31845e8c86bf87b378f51d64f719d66f2662552b129097950c4198"}],"payload_sha256":"09e6a35dfcf3859d114582c33011fe0e28c6779842dd2c1c2274ae19a0f950f3","residual_risks":["Provider interpretation is controlled in these tests, not a live-model semantic verification.","A dispatched provider request cannot be retroactively unsent; revoked/expired/STOP results are withheld before publication.","STOP integration applies to this explicit CSV route using the existing mission authority, not all ADL actions.","HTTP F10-F12 and browser evidence are separate work items; Table view is not chat-read evidence."],"role":"governance-action-engineer","scope_sha256":"405836501143c1d45705e284201ec0a928bbaf59447a9b6ba40a6cb86f8876e8","status":"DONE","verification":[{"command":"[\"/workspace/scratch/54b1628604af/adl-venv/bin/python\",\"-c\",\"import os,sys; os.chdir(\\\"BAGO_AGENTIC_DATA_LAB\\\"); sys.path.insert(0,os.getcwd()); import pytest; sys.exit(pytest.main([\\\"-q\\\",\\\"tests/test_csv_chat_access.py\\\",\\\"tests/test_workspace_read.py\\\",\\\"tests/test_document_tools_integration.py\\\",\\\"tests/project-permissions/backend/test_chat_saved_read_policy.py\\\"]))\"]","evidence":".bago/team/runtime/executions/fe42165d88c546d28d219dae222c2e2d/receipt.json","execution_id":"fe42165d88c546d28d219dae222c2e2d","id":"access","result":"PASS"}],"work_id":"W02"}
