{
  "work_id": "VERIFY",
  "role": "verification-engineer",
  "status": "DONE",
  "mission_id": "BAGO_CONTINUITY_PUBLICATION_20261101",
  "candidate_id": "9bdf09833dd28ab922485c21a23e0f645efb5cb812712150dd3c1b07d4f8fada",
  "scope_sha256": "0af844db09c04531999970ed71e0bce9ed1f51245b48416d0453a7bc7cef9df9",
  "changed_files": [
    "review/REPORT.md",
    "review/RESULT.json",
    "review/verify_independent_publication.py"
  ],
  "outputs": [
    {
      "kind": "independent-review-result",
      "path": "review/RESULT.json",
      "sha256": "74353fdd0f5383d1dc24c9e2b0e309300c87332447b2ca2ce3f2784d78bdd82c"
    },
    {
      "kind": "independent-review-report",
      "path": "review/REPORT.md",
      "sha256": "10f547703ffe8eb7992793e337a7dcd51b6da3c05d26b9cc04d03688f0b02089"
    },
    {
      "kind": "independent-checker",
      "path": "review/verify_independent_publication.py",
      "sha256": "14b7217982587970debbcecf4374fe419bdb0033181aeda766916d91441b730c"
    }
  ],
  "verification": [
    {
      "id": "independent-publication",
      "command": "[\"python\",\"-B\",\"review/verify_independent_publication.py\"]",
      "result": "PASS",
      "evidence": ".bago/team/runtime/executions/f6c3b607889c451dab344ac19a284588/receipt.json",
      "execution_id": "f6c3b607889c451dab344ac19a284588"
    }
  ],
  "residual_risks": [
    "Remote branch/PR identity and public availability are not established by VERIFY; PUBLISH remains required.",
    "The original goal remains NO_GO until publication is verified remotely.",
    "This safe projection intentionally omits private GOV grants, control/TaskStore state, lease keys, tokens, profiles, and reasoning; it is not a full GOV handoff reconstruction.",
    "Native /goal resume, product validation, Brave toolbar gesture, and video are not established by this evidence publication."
  ],
  "next_consumers": [
    "PUBLISH"
  ],
  "payload_sha256": "6ed0a7eb7f1ed7c21d1589ce99ab111474a26fd096c6f10202046b408dcee70d"
}
