{"candidate_id":"22d79bdf89e24c5260f63668c4992937b545d0ca0f364abd074421eca1d82356","changed_files":["BAGO_AGENTIC_DATA_LAB/tools/document-toolkit/document_toolkit/parsers.py","BAGO_AGENTIC_DATA_LAB/tools/document-toolkit/document_toolkit/csv_query.py","BAGO_AGENTIC_DATA_LAB/tests/test_csv_query.py","BAGO_AGENTIC_DATA_LAB/docs/verification/csv-chat-20261101/parser/pedidos-original.csv","BAGO_AGENTIC_DATA_LAB/docs/verification/csv-chat-20261101/parser/historical_query.json","BAGO_AGENTIC_DATA_LAB/docs/verification/csv-chat-20261101/parser/HISTORICAL_RESULT.json","BAGO_AGENTIC_DATA_LAB/docs/verification/csv-chat-20261101/parser/RESULT_SCHEMA.md","BAGO_AGENTIC_DATA_LAB/docs/verification/csv-chat-20261101/parser/REVIEW.md"],"findings":[{"affects_correction":true,"description":"Zero canonicalized before formatting; output encoded with finite streaming budget; independent original reproduction and regression pass.","id":"CSV-QUERY-EXPANSION","scope":"PRODUCT","severity":"P1","status":"CLOSED"},{"affects_correction":true,"description":"Full original Sniffer dialect preserved in legacy extraction; independent quotechar and skipinitialspace cases pass.","id":"CSV-LEGACY-DIALECT","scope":"PRODUCT","severity":"P2","status":"CLOSED"},{"affects_correction":true,"description":"Explicit Decimal Context yields identical output under adverse ambient traps/limits/rounding.","id":"CSV-DECIMAL-CONTEXT","scope":"PRODUCT","severity":"P2","status":"CLOSED"}],"mission_id":"CSV_CHAT_GOVERNED_20261101","next_consumers":["W12"],"outputs":[{"kind":"source","path":"BAGO_AGENTIC_DATA_LAB/tools/document-toolkit/document_toolkit/parsers.py","sha256":"6697263b88ad8a2fa6f6dcb8feac8200cb1f4f07e3f65845f7fb6d6e0ea944d5"},{"kind":"source","path":"BAGO_AGENTIC_DATA_LAB/tools/document-toolkit/document_toolkit/csv_query.py","sha256":"21186a611031209fa0072ef43148478ea4fea9802228e83aa8f90eb670298f64"},{"kind":"source","path":"BAGO_AGENTIC_DATA_LAB/tests/test_csv_query.py","sha256":"4e5da2fc8feeab6ae6574f8faa591386e4459cb514770fdce3806d7090b642c1"},{"kind":"verification","path":"BAGO_AGENTIC_DATA_LAB/docs/verification/csv-chat-20261101/parser/pedidos-original.csv","sha256":"8fe7a2979043c0e992f4e13d84055045ae1fec91bb896d365fe996367acbafe5"},{"kind":"verification","path":"BAGO_AGENTIC_DATA_LAB/docs/verification/csv-chat-20261101/parser/historical_query.json","sha256":"1e4b347f53bfdf542f979e5ec080d8d2a088165ae921a639482fd137c890afe7"},{"kind":"verification","path":"BAGO_AGENTIC_DATA_LAB/docs/verification/csv-chat-20261101/parser/HISTORICAL_RESULT.json","sha256":"edc20f35c25d5f18a7fefa4b9626301b7ffa5549895ac5ef7f0fa747a17f2c91"},{"kind":"verification","path":"BAGO_AGENTIC_DATA_LAB/docs/verification/csv-chat-20261101/parser/RESULT_SCHEMA.md","sha256":"4e30e4de50dd6ffdc848b16db4ad18bdb662da08a30c4c93e9058692bed51b09"},{"kind":"verification","path":"BAGO_AGENTIC_DATA_LAB/docs/verification/csv-chat-20261101/parser/REVIEW.md","sha256":"4e8feea302cc178181ebd642b7f776c898cf3537177eaeee26b28465c0af9ff0"}],"payload_sha256":"b7c6ffa7dcb87a8eadda4f0d737bd7e959f5858262838e12dfedc8996fb67377","residual_risks":["Pure parser/query checks do not verify main chat, live provider interpretation or Windows.","Numeric grouping/currency/exponents/formulas are deliberately rejected in arithmetic. Decimal rounding is disclosed at precision 38 and must remain visible in rendering.","parsers.py normalized CRLF to LF; code outside CSV parsing unchanged."],"role":"evidence-provenance-engineer","scope_sha256":"405836501143c1d45705e284201ec0a928bbaf59447a9b6ba40a6cb86f8876e8","status":"DONE","verification":[{"command":"[\"/workspace/scratch/54b1628604af/adl-venv/bin/python\",\"-c\",\"import os,sys; os.chdir(\\\"BAGO_AGENTIC_DATA_LAB\\\"); sys.path.insert(0,os.getcwd()); import pytest; sys.exit(pytest.main([\\\"-q\\\",\\\"tests/test_csv_query.py\\\",\\\"tests/document_tools/test_standalone.py\\\"]))\"]","evidence":".bago/team/runtime/executions/e710f70baa0649f89bf90744df0dcb5b/receipt.json","execution_id":"e710f70baa0649f89bf90744df0dcb5b","id":"query","result":"PASS"}],"work_id":"W03"}
